{
  "schema_version": "1.0.0",
  "id": "id-example-0001",
  "created_at": "2026-07-26T12:00:00Z",
  "system": "system-example-0001",
  "method_name": "method_name-example-0001",
  "method_version": "1.0.0",
  "normalized_inputs": {},
  "assumptions": {},
  "results": {},
  "units": {},
  "reconciliation": {},
  "code_revision": "code_revision-example-0001",
  "environment_digest": "sha256:aaaaaaaaaaaaaaaaaaaaaaaaaaaaaaaaaaaaaaaaaaaaaaaaaaaaaaaaaaaaaaaa",
  "artifact_digest": "sha256:aaaaaaaaaaaaaaaaaaaaaaaaaaaaaaaaaaaaaaaaaaaaaaaaaaaaaaaaaaaaaaaa",
  "limitations": []
}
